{
  "$schema": "https://json-schema.org/draft/2020-12/schema",
  "$id": "urn:vorton:contract:format-1",
  "title": "Vorton contract format 1 — proposed input structure",
  "description": "Structural schema for the proposed vorton.contract format 1 input reader. The decoder additionally rejects duplicate object members, requires unsigned decimal integer tokens, and applies the documented finite nesting profile. Source binding, type/effect/ownership checking and declaration validity are separate Checker responsibilities.",
  "type": "object",
  "properties": {"format":{"const":"vorton.contract"},"format_version":{"const":1},"semantics_version":{"const":"0.1"},"owner":{"type":"string","minLength":1},"records":{"type":"array","items":{"$ref":"#/$defs/Record"}},"display":{"$ref":"#/$defs/Display"}},
  "required": ["format","format_version","semantics_version","owner","records"],
  "additionalProperties": false,
  "$defs": {
    "Identifier": {"type":"string","pattern":"^[A-Za-z_][A-Za-z0-9_]*$"},
    "Path": {"type":"array","items":{"$ref":"#/$defs/Identifier"}},
    "Index": {"type":"integer","minimum":0,"maximum":18446744073709551615},
    "Display": {"type":"object","properties":{"label":{"type":"string"},"note":{"type":"string"}},"required":[],"additionalProperties":false},
    "LibraryRef": {"oneOf":[{"type":"object","properties":{"tag":{"const":"self"}},"required":["tag"],"additionalProperties":false},{"type":"object","properties":{"tag":{"const":"dependency"},"alias":{"$ref":"#/$defs/Identifier"}},"required":["tag","alias"],"additionalProperties":false}]},
    "DeclarationKind": {"enum":["function","struct","enum","trait","type_alias","const","effect","effect_alias","module","extern_type"]},
    "DeclRef": {"type":"object","properties":{"library":{"$ref":"#/$defs/LibraryRef"},"path":{"$ref":"#/$defs/Path"},"kind":{"$ref":"#/$defs/DeclarationKind"}},"required":["library","path","kind"],"additionalProperties":false},
    "TraitRef": {"allOf":[{"$ref":"#/$defs/DeclRef"},{"properties":{"kind":{"const":"trait"}}}]},
    "MemberKind": {"enum":["method","associated_type"]},
    "PatternTrait": {"type":"object","properties":{"trait":{"$ref":"#/$defs/TraitRef"},"arguments":{"type":"array","items":{"$ref":"#/$defs/TypePattern"}},"associated_bindings":{"type":"array","items":{"type":"object","properties":{"name":{"$ref":"#/$defs/Identifier"},"type":{"$ref":"#/$defs/TypePattern"}},"required":["name","type"],"additionalProperties":false}}},"required":["trait","arguments","associated_bindings"],"additionalProperties":false},
    "TypePattern": {"oneOf":[{"type":"object","properties":{"tag":{"const":"primitive"},"name":{"enum":["Int","Float","Str","Bool","Unit","Never"]}},"required":["tag","name"],"additionalProperties":false},{"type":"object","properties":{"tag":{"const":"ptr"},"pointee":{"$ref":"#/$defs/TypePattern"}},"required":["tag","pointee"],"additionalProperties":false},{"type":"object","properties":{"tag":{"const":"nominal"},"declaration":{"$ref":"#/$defs/DeclRef"},"arguments":{"type":"array","items":{"$ref":"#/$defs/TypePattern"}}},"required":["tag","declaration","arguments"],"additionalProperties":false},{"type":"object","properties":{"tag":{"const":"local_type_parameter"},"index":{"$ref":"#/$defs/Index"}},"required":["tag","index"],"additionalProperties":false},{"type":"object","properties":{"tag":{"const":"tuple"},"elements":{"type":"array","items":{"$ref":"#/$defs/TypePattern"},"minItems":2}},"required":["tag","elements"],"additionalProperties":false},{"type":"object","properties":{"tag":{"const":"associated"},"base":{"$ref":"#/$defs/TypePattern"},"trait":{"$ref":"#/$defs/PatternTrait"},"name":{"$ref":"#/$defs/Identifier"}},"required":["tag","base","trait","name"],"additionalProperties":false},{"type":"object","properties":{"tag":{"const":"list"},"element":{"$ref":"#/$defs/TypePattern"}},"required":["tag","element"],"additionalProperties":false},{"type":"object","properties":{"tag":{"const":"range"},"element":{"$ref":"#/$defs/TypePattern"}},"required":["tag","element"],"additionalProperties":false}]},
    "ImplRef": {"type":"object","properties":{"library":{"$ref":"#/$defs/LibraryRef"},"type_parameter_count":{"$ref":"#/$defs/Index"},"target":{"$ref":"#/$defs/TypePattern"},"trait":{"$ref":"#/$defs/PatternTrait"}},"required":["library","type_parameter_count","target"],"additionalProperties":false},
    "TraitMemberRef": {"type":"object","properties":{"tag":{"const":"trait_member"},"owner":{"$ref":"#/$defs/TraitRef"},"kind":{"$ref":"#/$defs/MemberKind"},"name":{"$ref":"#/$defs/Identifier"}},"required":["tag","owner","kind","name"],"additionalProperties":false},
    "ImplMemberRef": {"type":"object","properties":{"tag":{"const":"impl_member"},"owner":{"$ref":"#/$defs/ImplRef"},"kind":{"$ref":"#/$defs/MemberKind"},"name":{"$ref":"#/$defs/Identifier"}},"required":["tag","owner","kind","name"],"additionalProperties":false},
    "EntityRef": {"oneOf":[{"type":"object","properties":{"tag":{"const":"declaration"},"declaration":{"$ref":"#/$defs/DeclRef"}},"required":["tag","declaration"],"additionalProperties":false},{"$ref":"#/$defs/TraitMemberRef"},{"$ref":"#/$defs/ImplMemberRef"},{"type":"object","properties":{"tag":{"const":"impl"},"implementation":{"$ref":"#/$defs/ImplRef"}},"required":["tag","implementation"],"additionalProperties":false}]},
    "FunctionRef": {"oneOf":[{"type":"object","properties":{"tag":{"const":"declaration"},"declaration":{"allOf":[{"$ref":"#/$defs/DeclRef"},{"properties":{"kind":{"const":"function"}}}]}},"required":["tag","declaration"],"additionalProperties":false},{"allOf":[{"$ref":"#/$defs/TraitMemberRef"},{"properties":{"kind":{"const":"method"}}}]},{"allOf":[{"$ref":"#/$defs/ImplMemberRef"},{"properties":{"kind":{"const":"method"}}}]}]},
    "FormalRef": {"type":"object","properties":{"owner":{"$ref":"#/$defs/EntityRef"},"binder":{"enum":["declaration","impl","method"]},"kind":{"enum":["type","effect"]},"index":{"$ref":"#/$defs/Index"}},"required":["owner","binder","kind","index"],"additionalProperties":false},
    "TypeFormalRef": {"allOf":[{"$ref":"#/$defs/FormalRef"},{"properties":{"kind":{"const":"type"}}}]},
    "EffectFormalRef": {"allOf":[{"$ref":"#/$defs/FormalRef"},{"properties":{"kind":{"const":"effect"}}}]},
    "ParameterRef": {"oneOf":[{"type":"object","properties":{"tag":{"const":"receiver"}},"required":["tag"],"additionalProperties":false},{"type":"object","properties":{"tag":{"const":"position"},"index":{"$ref":"#/$defs/Index"}},"required":["tag","index"],"additionalProperties":false}]},
    "TraitUse": {"type":"object","properties":{"trait":{"$ref":"#/$defs/TraitRef"},"arguments":{"type":"array","items":{"$ref":"#/$defs/Type"}},"associated_bindings":{"type":"array","items":{"type":"object","properties":{"name":{"$ref":"#/$defs/Identifier"},"type":{"$ref":"#/$defs/Type"}},"required":["name","type"],"additionalProperties":false}}},"required":["trait","arguments","associated_bindings"],"additionalProperties":false},
    "Type": {"oneOf":[{"type":"object","properties":{"tag":{"const":"primitive"},"name":{"enum":["Int","Float","Str","Bool","Unit","Never"]}},"required":["tag","name"],"additionalProperties":false},{"type":"object","properties":{"tag":{"const":"ptr"},"pointee":{"$ref":"#/$defs/Type"}},"required":["tag","pointee"],"additionalProperties":false},{"type":"object","properties":{"tag":{"const":"nominal"},"declaration":{"$ref":"#/$defs/DeclRef"},"arguments":{"type":"array","items":{"$ref":"#/$defs/Type"}}},"required":["tag","declaration","arguments"],"additionalProperties":false},{"type":"object","properties":{"tag":{"const":"formal"},"formal":{"$ref":"#/$defs/TypeFormalRef"}},"required":["tag","formal"],"additionalProperties":false},{"type":"object","properties":{"tag":{"const":"tuple"},"elements":{"type":"array","items":{"$ref":"#/$defs/Type"},"minItems":2}},"required":["tag","elements"],"additionalProperties":false},{"type":"object","properties":{"tag":{"const":"associated"},"base":{"$ref":"#/$defs/Type"},"trait":{"$ref":"#/$defs/TraitUse"},"name":{"$ref":"#/$defs/Identifier"}},"required":["tag","base","trait","name"],"additionalProperties":false},{"type":"object","properties":{"tag":{"const":"function_item"},"function":{"$ref":"#/$defs/FunctionRef"},"owner_type_arguments":{"type":"array","items":{"$ref":"#/$defs/Type"}},"type_arguments":{"type":"array","items":{"$ref":"#/$defs/Type"}},"effect_arguments":{"type":"array","items":{"$ref":"#/$defs/EffectRow"}}},"required":["tag","function","owner_type_arguments","type_arguments","effect_arguments"],"additionalProperties":false},{"type":"object","properties":{"tag":{"const":"opaque_callable"},"function":{"$ref":"#/$defs/FunctionRef"},"owner_type_arguments":{"type":"array","items":{"$ref":"#/$defs/Type"}},"type_arguments":{"type":"array","items":{"$ref":"#/$defs/Type"}},"effect_arguments":{"type":"array","items":{"$ref":"#/$defs/EffectRow"}}},"required":["tag","function","owner_type_arguments","type_arguments","effect_arguments"],"additionalProperties":false},{"type":"object","properties":{"tag":{"const":"list"},"element":{"$ref":"#/$defs/Type"}},"required":["tag","element"],"additionalProperties":false},{"type":"object","properties":{"tag":{"const":"range"},"element":{"$ref":"#/$defs/Type"}},"required":["tag","element"],"additionalProperties":false},{"type":"object","properties":{"tag":{"const":"self_type"},"owner":{"$ref":"#/$defs/SelfOwner"}},"required":["tag","owner"],"additionalProperties":false}]},
    "Mode": {"enum":["borrow","mut","move"]},
    "ModeRule": {"oneOf":[{"type":"object","properties":{"tag":{"const":"fixed"},"mode":{"$ref":"#/$defs/Mode"}},"required":["tag","mode"],"additionalProperties":false},{"type":"object","properties":{"tag":{"const":"callable_use"},"callable":{"$ref":"#/$defs/Type"}},"required":["tag","callable"],"additionalProperties":false}]},
    "EscapeRule": {"enum":["noescape","may_escape"]},
    "EffectRow": {"type":"array","items":{"$ref":"#/$defs/EffectTerm"}},
    "EffectTerm": {"oneOf":[{"type":"object","properties":{"tag":{"const":"system"},"name":{"enum":["console","fs","process"]}},"required":["tag","name"],"additionalProperties":false},{"type":"object","properties":{"tag":{"const":"handled"},"effect":{"allOf":[{"$ref":"#/$defs/DeclRef"},{"properties":{"kind":{"const":"effect"}}}]},"arguments":{"type":"array","items":{"$ref":"#/$defs/Type"}}},"required":["tag","effect","arguments"],"additionalProperties":false},{"type":"object","properties":{"tag":{"const":"fail"},"payload":{"$ref":"#/$defs/Type"}},"required":["tag","payload"],"additionalProperties":false},{"type":"object","properties":{"tag":{"const":"mut"}},"required":["tag"],"additionalProperties":false},{"type":"object","properties":{"tag":{"const":"unsafe"}},"required":["tag"],"additionalProperties":false},{"type":"object","properties":{"tag":{"const":"formal"},"formal":{"$ref":"#/$defs/EffectFormalRef"}},"required":["tag","formal"],"additionalProperties":false},{"type":"object","properties":{"tag":{"const":"method_application"},"method":{"allOf":[{"$ref":"#/$defs/TraitMemberRef"},{"properties":{"kind":{"const":"method"}}}]},"self":{"$ref":"#/$defs/Type"},"trait_type_arguments":{"type":"array","items":{"$ref":"#/$defs/Type"}},"method_type_arguments":{"type":"array","items":{"$ref":"#/$defs/Type"}},"effect_arguments":{"type":"array","items":{"$ref":"#/$defs/EffectRow"}}},"required":["tag","method","self","trait_type_arguments","method_type_arguments","effect_arguments"],"additionalProperties":false},{"type":"object","properties":{"tag":{"const":"full_destruction"},"type":{"$ref":"#/$defs/Type"}},"required":["tag","type"],"additionalProperties":false},{"type":"object","properties":{"tag":{"const":"selected_call"},"callable":{"$ref":"#/$defs/Type"}},"required":["tag","callable"],"additionalProperties":false}]},
    "PatternPredicate": {"type":"object","properties":{"subject":{"$ref":"#/$defs/TypePattern"},"requires":{"$ref":"#/$defs/PatternTrait"}},"required":["subject","requires"],"additionalProperties":false},
    "ParameterTypeSet": {"type":"object","properties":{"parameter":{"$ref":"#/$defs/ParameterRef"},"type":{"$ref":"#/$defs/Type"}},"required":["parameter","type"],"additionalProperties":false},
    "ParameterModeSet": {"type":"object","properties":{"parameter":{"$ref":"#/$defs/ParameterRef"},"mode":{"$ref":"#/$defs/ModeRule"}},"required":["parameter","mode"],"additionalProperties":false},
    "ParameterEscapeSet": {"type":"object","properties":{"parameter":{"$ref":"#/$defs/ParameterRef"},"escape":{"$ref":"#/$defs/EscapeRule"}},"required":["parameter","escape"],"additionalProperties":false},
    "Set": {"type":"object","properties":{"parameter_types":{"type":"array","items":{"$ref":"#/$defs/ParameterTypeSet"},"minItems":1},"return_type":{"$ref":"#/$defs/Type"},"parameter_modes":{"type":"array","items":{"$ref":"#/$defs/ParameterModeSet"},"minItems":1},"parameter_escape":{"type":"array","items":{"$ref":"#/$defs/ParameterEscapeSet"},"minItems":1},"effect_upper":{"$ref":"#/$defs/EffectRow"},"generic_requirements":{"type":"array","items":{"$ref":"#/$defs/GenericRequirement"}}},"required":[],"additionalProperties":false,"minProperties":1},
    "Visibility": {"enum":["public","private"]},
    "FieldRequirement": {"type":"object","properties":{"name":{"$ref":"#/$defs/Identifier"},"type":{"$ref":"#/$defs/Type"},"visibility":{"$ref":"#/$defs/Visibility"}},"required":["name"],"additionalProperties":false},
    "ParameterRequirement": {"type":"object","properties":{"parameter":{"$ref":"#/$defs/ParameterRef"},"type":{"$ref":"#/$defs/Type"}},"required":["parameter"],"additionalProperties":false},
    "VariantLayout": {"oneOf":[{"type":"object","properties":{"tag":{"const":"unit"}},"required":["tag"],"additionalProperties":false},{"type":"object","properties":{"tag":{"const":"tuple"},"elements":{"type":"array","items":{"$ref":"#/$defs/Type"}}},"required":["tag","elements"],"additionalProperties":false},{"type":"object","properties":{"tag":{"const":"named"},"match":{"enum":["exact","contains"]},"ordered":{"type":"boolean"},"fields":{"type":"array","items":{"$ref":"#/$defs/FieldRequirement"}}},"required":["tag","match","ordered","fields"],"additionalProperties":false}]},
    "VariantRequirement": {"type":"object","properties":{"name":{"$ref":"#/$defs/Identifier"},"layout":{"$ref":"#/$defs/VariantLayout"}},"required":["name"],"additionalProperties":false},
    "MemberRequirement": {"type":"object","properties":{"name":{"$ref":"#/$defs/Identifier"},"kind":{"$ref":"#/$defs/MemberKind"}},"required":["name","kind"],"additionalProperties":false},
    "StructureCheck": {"oneOf":[{"type":"object","properties":{"tag":{"const":"parameters"},"match":{"enum":["exact","contains"]},"items":{"type":"array","items":{"$ref":"#/$defs/ParameterRequirement"}}},"required":["tag","match","items"],"additionalProperties":false},{"type":"object","properties":{"tag":{"const":"fields"},"match":{"enum":["exact","contains"]},"ordered":{"type":"boolean"},"items":{"type":"array","items":{"$ref":"#/$defs/FieldRequirement"}}},"required":["tag","match","ordered","items"],"additionalProperties":false},{"type":"object","properties":{"tag":{"const":"variants"},"match":{"enum":["exact","contains"]},"ordered":{"type":"boolean"},"items":{"type":"array","items":{"$ref":"#/$defs/VariantRequirement"}}},"required":["tag","match","ordered","items"],"additionalProperties":false},{"type":"object","properties":{"tag":{"const":"members"},"match":{"enum":["exact","contains"]},"items":{"type":"array","items":{"$ref":"#/$defs/MemberRequirement"}},"ordered":{"type":"boolean"}},"required":["tag","match","items","ordered"],"additionalProperties":false}]},
    "Namespace": {"enum":["type","value","effect"]},
    "ExportName": {"type":"object","properties":{"path":{"type":"array","items":{"$ref":"#/$defs/Identifier"},"minItems":1},"namespace":{"$ref":"#/$defs/Namespace"}},"required":["path","namespace"],"additionalProperties":false},
    "ExportRequirement": {"type":"object","properties":{"name":{"$ref":"#/$defs/ExportName"},"target":{"$ref":"#/$defs/EntityRef"}},"required":["name"],"additionalProperties":false},
    "ExportsCheck": {"type":"object","properties":{"match":{"enum":["exact","contains"]},"items":{"type":"array","items":{"$ref":"#/$defs/ExportRequirement"}}},"required":["match","items"],"additionalProperties":false},
    "ImplAllowance": {"type":"object","properties":{"implementation":{"$ref":"#/$defs/ImplRef"},"predicates":{"type":"array","items":{"$ref":"#/$defs/PatternPredicate"}}},"required":["implementation","predicates"],"additionalProperties":false},
    "RejectNewCheck": {"type":"object","properties":{"allowed_exports":{"type":"array","items":{"$ref":"#/$defs/ExportName"}},"allowed_impls":{"type":"array","items":{"$ref":"#/$defs/ImplAllowance"}}},"required":["allowed_exports","allowed_impls"],"additionalProperties":false},
    "Check": {"type":"object","properties":{"return_traits":{"type":"array","items":{"$ref":"#/$defs/TraitUse"},"minItems":1},"structure":{"type":"array","items":{"$ref":"#/$defs/StructureCheck"},"minItems":1},"visibility":{"$ref":"#/$defs/Visibility"},"exports":{"$ref":"#/$defs/ExportsCheck"},"reject_new":{"$ref":"#/$defs/RejectNewCheck"}},"required":[],"additionalProperties":false,"minProperties":1},
    "Record": {"type":"object","properties":{"target":{"$ref":"#/$defs/EntityRef"},"set":{"$ref":"#/$defs/Set"},"check":{"$ref":"#/$defs/Check"},"display":{"$ref":"#/$defs/Display"},"type_parameters":{"type":"array","items":{"$ref":"#/$defs/Identifier"}}},"required":["target"],"additionalProperties":false,"anyOf":[{"required":["set"]},{"required":["check"]}]},
    "ShapeParameter": {"type":"object","properties":{"type":{"$ref":"#/$defs/Type"},"mode":{"$ref":"#/$defs/ModeRule"},"escape":{"$ref":"#/$defs/EscapeRule"}},"required":["type","mode","escape"],"additionalProperties":false},
    "CallableShapeConstraint": {"type":"object","properties":{"parameters":{"type":"array","items":{"$ref":"#/$defs/ShapeParameter"}},"result":{"$ref":"#/$defs/Type"},"effect_upper":{"$ref":"#/$defs/EffectRow"}},"required":["parameters","result"],"additionalProperties":false},
    "GenericRequirement": {"oneOf":[{"type":"object","properties":{"tag":{"const":"trait"},"subject":{"$ref":"#/$defs/Type"},"bound":{"$ref":"#/$defs/TraitUse"}},"required":["tag","subject","bound"],"additionalProperties":false},{"type":"object","properties":{"tag":{"const":"callable_shape"},"subject":{"$ref":"#/$defs/Type"},"shape":{"$ref":"#/$defs/CallableShapeConstraint"}},"required":["tag","subject","shape"],"additionalProperties":false}]},
    "SelfOwner": {"oneOf":[{"type":"object","properties":{"tag":{"const":"declaration"},"declaration":{"allOf":[{"$ref":"#/$defs/DeclRef"},{"properties":{"kind":{"enum":["struct","enum","trait"]}}}]}},"required":["tag","declaration"],"additionalProperties":false},{"type":"object","properties":{"tag":{"const":"impl"},"implementation":{"$ref":"#/$defs/ImplRef"}},"required":["tag","implementation"],"additionalProperties":false}]}
  }
}
