{
  "format": "vorton.contract",
  "format_version": 1,
  "semantics_version": "0.1",
  "owner": "app",
  "records": [
    {
      "target": {
        "tag": "declaration",
        "declaration": {
          "library": { "tag": "self" },
          "path": ["f"],
          "kind": "function"
        }
      },
      "set": {
        "effect_upper": [
          {
            "tag": "handled",
            "effect": {
              "library": { "tag": "self" },
              "path": ["Signal"],
              "kind": "effect"
            },
            "arguments": []
          }
        ]
      }
    }
  ]
}
